Symbol,Name,Country,Sector,Industry,float shares
DUNE,Dune Acquisition Corporation Class A Common Stock,United States,Finance,Investment Bankers/Brokers/Service,1182043.0
DUNEU,Dune Acquisition Corporation Unit,United States,Finance,Investment Bankers/Brokers/Service,1182043.0
DUO,Fangdd Network Group Ltd. American Depositary Shares,China,Finance,Real Estate,3656293.0
DUOL,Duolingo Inc. Class A Common Stock,United States,Technology,Computer Software: Prepackaged Software,30716935.0
DUOT,Duos Technologies Group Inc. Common Stock,United States,Technology,Computer Software: Prepackaged Software,3760992.0
DVAX,Dynavax Technologies Corporation Common Stock,United States,Health Care,Biotechnology: Pharmaceutical Preparations,121936322.0
DWAC,Digital World Acquisition Corp. Class A Common Stock,United States,Technology,Computer Software: Programming Data Processing,30016744.0
DWACU,Digital World Acquisition Corp. Units,United States,Technology,Computer Software: Programming Data Processing,30016744.0
DWACW,Digital World Acquisition Corp. Warrants,United States,Technology,Computer Software: Programming Data Processing,30016744.0
DWSN,Dawson Geophysical Company Common Stock,United States,Energy,Oil & Gas Production,6152639.0
DXCM,DexCom Inc. Common Stock,United States,Health Care,Medical/Dental Instruments,384838639.0
DXF,Dunxin Financial Holdings Limited American Depositary Shares,China,Finance,Finance: Consumer Services,1452983.0
DXLG,Destination XL Group Inc. Common Stock,United States,Consumer Discretionary,Clothing/Shoe/Accessory Stores,
DXPE,DXP Enterprises Inc. Common Stock,United States,Industrials,Industrial Machinery/Components,13527719.0
DXR,Daxor Corporation Common Stock,United States,Health Care,Medical/Dental Instruments,1794652.0
DXYN,Dixie Group Inc. (The) Common Stock,United States,Consumer Discretionary,Home Furnishings,9663708.0
DYAI,Dyadic International Inc. Common Stock,United States,Health Care,Biotechnology: Biological Products (No Diagnostic Substances),18701548.0
DYN,Dyne Therapeutics Inc. Common Stock,United States,Health Care, Medicinal Chemicals and Botanical Products ,39818918.0
DYNT,Dynatronics Corporation Common Stock,United States,Health Care,Medical/Dental Instruments,3165808.0
DZSI,DZS Inc. Common Stock,United States,Utilities,Telecommunications Equipment,21544182.0
EA,Electronic Arts Inc. Common Stock,United States,Technology,Computer Software: Prepackaged Software,245237359.0
EAC,Edify Acquisition Corp. Class A Common Stock,United States,Finance,Blank Checks,1687648.0
EACPW,Edify Acquisition Corp. Warrant,United States,Finance,Blank Checks,
EAD,Allspring Income Opportunities Fund Common Shares,United States,Finance,Finance/Investors Services,
EAR,Eargo Inc. Common Stock,United States,Health Care,Medical Specialities,3802775.0
EAST,Eastside Distilling Inc. Common Stock,United States,Consumer Staples,Beverages (Production/Distribution),1043102.0
EBAY,eBay Inc. Common Stock,United States,Consumer Discretionary,Catalog/Specialty Distribution,530332090.0
EBC,Eastern Bankshares Inc. Common Stock,United States,Finance,Accident &Health Insurance,144699798.0
EBET,EBET INC. Common Stock,United States,Consumer Discretionary,Services-Misc. Amusement & Recreation,294879005.0
EBIX,Ebix Inc. Common Stock,United States,Technology,EDP Services,24248669.0
EBMT,Eagle Bancorp Montana Inc. Common Stock,United States,Finance,Major Banks,7058881.0
EBON,Ebang International Holdings Inc. Class A Ordinary Shares,China,Technology,Semiconductors,4610204.0
EBTC,Enterprise Bancorp Inc Common Stock,United States,Finance,Major Banks,9079166.0
ECBK,ECB Bancorp Inc. Common Stock,United States,Finance,Banks,8746304.0
ECF,Ellsworth Growth and Income Fund Ltd.,United States,Finance,Finance/Investors Services,
ECOR,electroCore Inc. Common Stock,United States,Health Care,Biotechnology: Electromedical & Electrotherapeutic Apparatus,5133192.0
ECPG,Encore Capital Group Inc Common Stock,United States,Finance,Finance Companies,22968651.0
ECX,ECARX Holdings Inc. Class A Ordinary shares,China,Technology,EDP Services,70087144.0
ECXWW,ECARX Holdings Inc. Warrants,China,Technology,EDP Services,
EDAP,EDAP TMS S.A. American Depositary Shares,France,Health Care,Biotechnology: Electromedical & Electrotherapeutic Apparatus,
EDBL,Edible Garden AG Incorporated Common Stock,United States,Consumer Staples,Farming/Seeds/Milling,2550961.0
EDBLW,Edible Garden AG Incorporated Warrant,United States,Consumer Staples,Farming/Seeds/Milling,
EDIT,Editas Medicine Inc. Common Stock,United States,Health Care,Biotechnology: Biological Products (No Diagnostic Substances),74789287.0
EDRY,EuroDry Ltd. Common Shares ,Greece,Consumer Discretionary,Marine Transportation,1381212.0
EDSA,Edesa Biotech Inc. Common Shares,United States,Health Care,Pharmaceuticals and Biotechnology,14073264.0
EDTK,Skillful Craftsman Education Technology Limited Ordinary Share,China,Consumer Discretionary,Educational Services,7924487.0
EDUC,Educational Development Corporation Common Stock,United States,Consumer Discretionary,Consumer Specialties,5794358.0
EEFT,Euronet Worldwide Inc. Common Stock,United States,Finance,Investment Bankers/Brokers/Service,46919098.0
EEIQ,EpicQuest Education Group International Limited Common Stock,United States,Consumer Discretionary,Educational Services,3723316.0
EFHT,EF Hutton Acquisition Corporation I Common Stock,United States,Consumer Discretionary,Auto Manufacturing,12249890.0
EFHTW,EF Hutton Acquisition Corporation I Warrant,United States,Consumer Discretionary,Auto Manufacturing,
EFOI,Energy Focus Inc. Common Stock,United States,Consumer Discretionary,Building Products,1862083.0
EFSC,Enterprise Financial Services Corporation Common Stock,United States,Finance,Major Banks,35338091.0
EFSCP,Enterprise Financial Services Corporation Depositary Shares Each Representing a 1/40th Interest in a Share of 5% Fixed Rate Non-Cumulative Perpetual Preferred Stock Series A,United States,Finance,Major Banks,35338091.0
EFTR,eFFECTOR Therapeutics Inc. Common Stock,United States,Health Care,Biotechnology: Pharmaceutical Preparations,40623863.0
EFTRW,eFFECTOR Therapeutics Inc. Warrant,United States,Health Care,Biotechnology: Pharmaceutical Preparations,
EGAN,eGain Corporation Common Stock,United States,Technology,Computer Software: Prepackaged Software,17099185.0
EGBN,Eagle Bancorp Inc. Common Stock,United States,Finance,Major Banks,29068569.0
EGHT,8x8 Inc Common Stock,United States,Technology,EDP Services,89881320.0
EGIO,Edgio Inc. Common Stock,United States,Consumer Discretionary,Business Services,137035273.0
EGLX,Enthusiast Gaming Holdings Inc. Common Stock,Canada,Consumer Discretionary,Services-Misc. Amusement & Recreation,137617485.0
EGRX,Eagle Pharmaceuticals Inc. Common Stock,United States,Health Care,Biotechnology: Pharmaceutical Preparations,11451781.0
EH,EHang Holdings Limited ADS,China,Industrials,Military/Government/Technical,38539197.0
EHTH,eHealth Inc. Common Stock,United States,Finance,Specialty Insurers,22523849.0
EIGR,Eiger BioPharmaceuticals Inc. Common Stock,United States,Health Care,Biotechnology: Biological Products (No Diagnostic Substances),35340567.0
EIM,Eaton Vance Municipal Bond Fund Common Shares of Beneficial Interest $.01 par value,United States,Finance,Finance/Investors Services,
EJH,E-Home Household Service Holdings Limited Ordinary Shares,China,Consumer Discretionary,Other Consumer Services,152620.0
EKSO,Ekso Bionics Holdings Inc. Common Stock,United States,Industrials,Industrial Machinery/Components,12085638.0
ELA,Envela Corporation Common Stock,United States,Consumer Discretionary,Consumer Specialties,7466665.0
ELDN,Eledon Pharmaceuticals Inc. Common Stock,United States,Health Care,Biotechnology: Pharmaceutical Preparations,17343578.0
ELEV,Elevation Oncology Inc. Common stock,United States,Health Care,Biotechnology: Pharmaceutical Preparations,19916975.0
ELLO,Ellomay Capital Ltd Ordinary Shares (Israel),Israel,Utilities,Electric Utilities: Central,6907709.0
ELMD,Electromed Inc. Common Stock,United States,Health Care,Biotechnology: Electromedical & Electrotherapeutic Apparatus,5926213.0
ELOX,Eloxx Pharmaceuticals Inc. Common Stock,United States,Health Care,Biotechnology: Biological Products (No Diagnostic Substances),2373084.0
ELSE,Electro-Sensors Inc. Common Stock,United States,Industrials,Industrial Machinery/Components,1961514.0
ELTK,Eltek Ltd. Ordinary Shares,Israel,Technology,Electrical Products,1898858.0
ELTX,Elicio Therapeutics Inc. Common Stock,United States,Health Care,Biotechnology: Pharmaceutical Preparations,4132403.0
ELVN,Enliven Therapeutics Inc. Common Stock,United States,Health Care,Biotechnology: Pharmaceutical Preparations,11992257.0
ELYM,Eliem Therapeutics Inc Common Stock,United States,Health Care,Biotechnology: Pharmaceutical Preparations,4621153.0
ELYS,Elys Game Technology Corp. Common Stock,United States,Technology,Computer Software: Prepackaged Software,30204154.0
EM,Smart Share Global Limited American Depositary Shares,China,Consumer Discretionary,Other Consumer Services,48154915.0
EMAN,eMagin Corporation Common Stock,United States,Technology,Semiconductors,78435390.0
EMBC,Embecta Corp. Common Stock,United States,Health Care,Medical/Dental Instruments,56759172.0
EMCG,Embrace Change Acquisition Corp Ordinary Shares,United States,Finance,Blank Checks,5866142.0
EMCGR,Embrace Change Acquisition Corp Rights,United States,Finance,Blank Checks,
EMCGW,Embrace Change Acquisition Corp Warrants,United States,Finance,Blank Checks,
EMKR,EMCORE Corporation Common Stock,United States,Technology,Semiconductors,47469493.0
EML,Eastern Company (The) Common Stock,United States,Consumer Discretionary,Industrial Machinery/Components,4608618.0
EMLD,FTAC Emerald Acquisition Corp. Class A Common Stock,United States,Finance,Blank Checks,20494042.0
EMLDU,FTAC Emerald Acquisition Corp. Unit,United States,Finance,Blank Checks,20494042.0
EMLDW,FTAC Emerald Acquisition Corp. Warrant,United States,Finance,Blank Checks,
EMX,EMX Royalty Corporation Common Shares (Canada),Canada,Basic Materials,Metal Mining,93401330.0
ENCP,Energem Corp Class A Ordinary Shares,Malaysia,Energy,Industrial Machinery/Components,710003.0
ENCPW,Energem Corp Warrant,Malaysia,Energy,Industrial Machinery/Components,
ENER,Accretion Acquisition Corp. Common Stock,United States,Finance,Blank Checks,4749333.0
ENERR,Accretion Acquisition Corp. Right,United States,Finance,Blank Checks,
ENERU,Accretion Acquisition Corp. Unit,United States,Finance,Blank Checks,4749333.0
ENG,ENGlobal Corporation Common Stock,United States,Consumer Discretionary,Military/Government/Technical,30279867.0
ENLV,Enlivex Therapeutics Ltd. Ordinary Shares,Israel,Health Care,Biotechnology: Pharmaceutical Preparations,14948255.0
ENPH,Enphase Energy Inc. Common Stock,United States,Technology,Semiconductors,131065245.0
ENSC,Ensysce Biosciences Inc. Common Stock,United States,Health Care,Biotechnology: Pharmaceutical Preparations,2417871.0
ENSG,The Ensign Group Inc. Common Stock,United States,Health Care,Hospital/Nursing Management,53625488.0
ENSV,Enservco Corporation Common Stock,United States,Energy,Oilfield Services/Equipment,16605488.0
ENTA,Enanta Pharmaceuticals Inc. Common Stock,United States,Health Care,Biotechnology: Pharmaceutical Preparations,15736800.0
ENTG,Entegris Inc. Common Stock,United States,Industrials,Plastic Products,149345735.0
ENTX,Entera Bio Ltd. Ordinary Shares,Israel,Health Care,Biotechnology: Biological Products (No Diagnostic Substances),19670421.0
ENVB,Enveric Biosciences Inc. Common Stock,United States,Health Care,Biotechnology: Pharmaceutical Preparations,2016089.0
ENVX,Enovix Corporation Common Stock,United States,Miscellaneous,Industrial Machinery/Components,133771646.0
ENX,Eaton Vance New York Municipal Bond Fund Common Shares of Beneficial Interest $.01 par value,United States,Finance,Finance/Investors Services,
EOLS,Evolus Inc. Common Stock,United States,Health Care,Biotechnology: Pharmaceutical Preparations,39897186.0
EOSE,Eos Energy Enterprises Inc. Class A Common Stock,United States,Miscellaneous,Industrial Machinery/Components,111779557.0
EOSEW,Eos Energy Enterprises Inc. Warrant,United States,Miscellaneous,Industrial Machinery/Components,
EP,Empire Petroleum Corporation Common Stock,United States,Energy,Oil & Gas Production,16364985.0
EPIX,ESSA Pharma Inc. Common Stock,Canada,Health Care,Biotechnology: Pharmaceutical Preparations,24350719.0
EPM,Evolution Petroleum Corporation Inc. Common Stock,United States,Energy,Oil & Gas Production,29643792.0
EPOW,Sunrise New Energy Co. Ltd Ordinary Shares,China,Consumer Discretionary,Business Services,11224258.0
EQ,Equillium Inc. Common Stock,United States,Health Care,Biotechnology: Pharmaceutical Preparations,18960477.0
EQIX,Equinix Inc. Common Stock REIT,United States,Real Estate,Real Estate Investment Trusts,93247742.0
EQRX,EQRx Inc.  Common Stock,United States,Health Care,Biotechnology: Pharmaceutical Preparations,279420398.0
EQRXW,EQRx Inc. Warrant,United States,Health Care,Biotechnology: Pharmaceutical Preparations,
ERAS,Erasca Inc. Common Stock,United States,Health Care,Biotechnology: Pharmaceutical Preparations,76464381.0
ERC,Allspring Multi-Sector Income Fund Common Stock,United States,Finance,Finance/Investors Services,
ERIC,Ericsson American Depositary Shares,Sweden,Technology,Radio And Television Broadcasting And Communications Equipment,5948869485.0
ERIE,Erie Indemnity Company Class A Common Stock,United States,Finance,Specialty Insurers,25116915.0
ERII,Energy Recovery Inc. Common Stock,United States,Technology,Industrial Machinery/Components,55156632.0
ERNA,Eterna Therapeutics Inc. Common Stock,United States,Health Care,Biotechnology: Pharmaceutical Preparations,3486526.0
ESAC,ESGEN Acquisition Corporation Class A Ordinary Shares,United States,Finance,Blank Checks,2896547.0
ESACW,ESGEN Acquisition Corporation Warrants,United States,Finance,Blank Checks,
ESCA,Escalade Incorporated Common Stock,United States,Consumer Discretionary,Recreational Games/Products/Toys,8964636.0
ESEA,Euroseas Ltd. Common Stock (Marshall Islands),Greece,Consumer Discretionary,Marine Transportation,2832790.0
ESGR,Enstar Group Limited Ordinary Shares,Bermuda,Finance,Property-Casualty Insurers,12824066.0
ESGRO,Enstar Group Limited Depository Shares 7.00% Perpetual Non-Cumulative Preference Shares Series E,Bermuda,Finance,Property-Casualty Insurers,12824066.0
ESGRP,Enstar Group Limited Depositary Shares Each Representing 1/1000th of an interest in Preference Shares,Bermuda,Finance,Property-Casualty Insurers,12824066.0
ESHA,ESH Acquisition Corp. Class A Common Stock,United States,Finance,Blank Checks,11787477.0
ESHAR,ESH Acquisition Corp. Right,United States,Finance,Blank Checks,
ESLT,Elbit Systems Ltd. Ordinary Shares,Israel,Industrials,Military/Government/Technical,24643297.0
ESOA,Energy Services of America Corporation Common Stock,United States,Industrials,Water Sewer Pipeline Comm & Power Line Construction,9588921.0
ESP,Espey Mfg. & Electronics Corp. Common Stock,United States,Technology,Industrial Machinery/Components,1420629.0
ESPR,Esperion Therapeutics Inc. Common Stock,United States,Health Care,Biotechnology: Pharmaceutical Preparations,91445862.0
ESQ,Esquire Financial Holdings Inc. Common Stock,United States,Finance,Commercial Banks,5750561.0
ESSA,ESSA Bancorp Inc. Common Stock,United States,Finance,Banks,6881952.0
ESTA,Establishment Labs Holdings Inc. Common Shares,Costa Rica,Health Care,Industrial Specialties,15533447.0
ETAO,Etao International Co. Ltd. Ordinary Shares,United States,Finance,Blank Checks,11834552.0
ETNB,89bio Inc. Common Stock,United States,Health Care,Biotechnology: Pharmaceutical Preparations,63480178.0
ETON,Eton Pharmaceuticals Inc. Common Stock,United States,Health Care,Biotechnology: Pharmaceutical Preparations,20107388.0
ETSY,Etsy Inc. Common Stock,United States,Consumer Discretionary,Business Services,121943580.0
EUDA,EUDA Health Holdings Limited Ordinary Shares,Singapore,Finance,Blank Checks,5811317.0
EVAX,Evaxion Biotech A/S American Depositary Share,Denmark,Health Care,Biotechnology: Biological Products (No Diagnostic Substances),18991927.0
EVBG,Everbridge Inc. Common Stock,United States,Technology,Retail: Computer Software & Peripheral Equipment,40467221.0
EVBN,Evans Bancorp Inc. Common Stock,United States,Finance,Major Banks,4080423.0
EVCM,EverCommerce Inc. Common Stock,United States,Technology,EDP Services,21284288.0
EVER,EverQuote Inc. Class A Common Stock,United States,Technology,Computer Software: Programming Data Processing,20150569.0
EVGN,Evogene Ltd Ordinary Shares,Israel,Industrials,Agricultural Chemicals,40884971.0
EVGO,EVgo Inc. Class A Common Stock,United States,Consumer Discretionary,Other Specialty Stores,96377704.0
EVGOW,EVgo Inc. Warrants,United States,Consumer Discretionary,Other Specialty Stores,
EVGR,Evergreen Corporation Class A Ordinary Share,Malaysia,Finance,Blank Checks,10410056.0
EVI,EVI Industries Inc.  Common Stock,United States,Industrials,Industrial Machinery/Components,5232724.0
EVLO,Evelo Biosciences Inc. Common Stock,United States,Health Care,Biotechnology: Pharmaceutical Preparations,7222871.0
EVLV,Evolv Technologies Holdings Inc. Class A Common Stock,United States,Technology,Computer peripheral equipment,78912272.0
EVLVW,Evolv Technologies Holdings Inc. Warrant,United States,Technology,Computer peripheral equipment,78912272.0
EVM,Eaton Vance California Municipal Bond Fund Common Shares of Beneficial Interest $.01 par value,United States,Finance,Finance/Investors Services,
EVO,Evotec SE American Depositary Shares,Germany,Health Care,Biotechnology: Pharmaceutical Preparations,286269038.0
EVOK,Evoke Pharma Inc. Common Stock,United States,Health Care,Biotechnology: Pharmaceutical Preparations,3255114.0
EVRG,Evergy Inc. Common Stock,United States,Utilities,Power Generation,228652415.0
EVTV,Envirotech Vehicles Inc. Common Stock,United States,Consumer Discretionary,Auto Manufacturing,12371218.0
EVV,Eaton Vance Limited Duration Income Fund Common Shares of Beneficial Interest,United States,Finance,Finance/Investors Services,
EWBC,East West Bancorp Inc. Common Stock,United States,Finance,Major Banks,140049024.0
EWCZ,European Wax Center Inc. Class A Common Stock,United States,Consumer Discretionary,Package Goods/Cosmetics,36860350.0
EWTX,Edgewise Therapeutics Inc. Common Stock,United States,Health Care,Biotechnology: Pharmaceutical Preparations,28823853.0
EXAI,Exscientia Plc American Depositary Shares,United Kingdom,Health Care,Biotechnology: Biological Products (No Diagnostic Substances),105117935.0
EXAS,Exact Sciences Corporation Common Stock,United States,Health Care,Medical Specialities,178867707.0
EXC,Exelon Corporation Common Stock,United States,Utilities,Power Generation,993577083.0
EXEL,Exelixis Inc. Common Stock,United States,Health Care,Biotechnology: Biological Products (No Diagnostic Substances),286819698.0
EXFY,Expensify Inc. Class A Common Stock,United States,Technology,Computer Software: Prepackaged Software,44049536.0
EXLS,ExlService Holdings Inc. Common Stock,United States,Consumer Discretionary,Business Services,160785185.0
EXPD,Expeditors International of Washington Inc. Common Stock,United States,Consumer Discretionary,Oil Refining/Marketing,146848585.0
EXPE,Expedia Group Inc. Common Stock,United States,Consumer Discretionary,Transportation Services,137002110.0
EXPI,eXp World Holdings Inc. Common Stock,United States,Finance,Real Estate,76941538.0
EXPO,Exponent Inc. Common Stock,United States,Consumer Discretionary,Professional Services,50117224.0
EXTR,Extreme Networks Inc. Common Stock,United States,Telecommunications,Telecommunications Equipment,124403018.0
EYE,National Vision Holdings Inc. Common Stock,United States,Health Care,Ophthalmic Goods,76823635.0
EYEN,Eyenovia Inc. Common Stock,United States,Health Care,Biotechnology: Pharmaceutical Preparations,31081485.0
EYPT,EyePoint Pharmaceuticals Inc. Common Stock,United States,Industrials,Biotechnology: Laboratory Analytical Instruments,15667954.0
EZFL,EzFill Holdings Inc. Common Stock,United States,Technology,EDP Services,1446253.0
EZGO,EZGO Technologies Ltd. Ordinary Shares,China,Consumer Discretionary,Motor Vehicles,45599332.0
EZPW,EZCORP Inc. Class A Non Voting Common Stock,United States,Miscellaneous,Diversified Commercial Services,50217175.0
FA,First Advantage Corporation Common Stock,United States,Consumer Discretionary,Business Services,49991365.0
FAMI,Farmmi Inc. Ordinary Shares,China,Consumer Staples,Packaged Foods,23699711.0
FANG,Diamondback Energy Inc. Common Stock,United States,Energy,Oil & Gas Production,177945788.0
FANH,Fanhua Inc. American Depositary Shares,China,Finance,Specialty Insurers,39134813.0
FARM,Farmer Brothers Company Common Stock,United States,Consumer Staples,Packaged Foods,14906506.0
FARO,FARO Technologies Inc. Common Stock,United States,Industrials,Industrial Machinery/Components,17446262.0
FAST,Fastenal Company Common Stock,United States,Consumer Discretionary,RETAIL: Building Materials,569950378.0
FAT,FAT Brands Inc. Class A Common Stock,United States,Consumer Discretionary,Restaurants,2288955.0
FATBB,FAT Brands Inc. Class B Common Stock,United States,Consumer Discretionary,Restaurants,2288955.0
FATBP,FAT Brands Inc. 8.25% Series B Cumulative Preferred Stock,United States,Consumer Discretionary,Restaurants,2288955.0
FATE,Fate Therapeutics Inc. Common Stock,United States,Health Care,Biotechnology: Biological Products (No Diagnostic Substances),83811578.0
FATP,Fat Projects Acquisition Corp Class A Ordinary Share,Singapore,Consumer Discretionary,Restaurants,
FATPW,Fat Projects Acquisition Corp Warrant,Singapore,Consumer Discretionary,Restaurants,
FAX,abrdn Asia-Pacific Income Fund Inc. Common Stock,United States,Finance,Investment Managers,
FAZE,FaZe Holdings Inc. Common Stock,United States,Industrials,Industrial Machinery/Components,45245186.0
FAZEW,FaZe Holdings Inc. Warrant,United States,Industrials,Industrial Machinery/Components,
FBIO,Fortress Biotech Inc. Common Stock,United States,Health Care,Biotechnology: Pharmaceutical Preparations,92445215.0
FBIOP,Fortress Biotech Inc. 9.375% Series A Cumulative Redeemable Perpetual Preferred Stock,United States,Health Care,Biotechnology: Pharmaceutical Preparations,92445215.0
FBIZ,First Business Financial Services Inc. Common Stock,United States,Finance,Major Banks,7263392.0
FBMS,First Bancshares Inc.,United States,Finance,Major Banks,25411482.0
FBNC,First Bancorp Common Stock,United States,Finance,Major Banks,39446835.0
FBRX,Forte Biosciences Inc. Common Stock,United States,Health Care,Biotechnology: Pharmaceutical Preparations,29024329.0
FCAP,First Capital Inc. Common Stock,United States,Finance,Savings Institutions,3184099.0
FCBC,First Community Bankshares Inc. (VA) Common Stock,United States,Finance,Major Banks,15865707.0
FCCO,First Community Corporation Common Stock,United States,Finance,Major Banks,6640970.0
FCEL,FuelCell Energy Inc. Common Stock,United States,Energy,Industrial Machinery/Components,406032527.0
FCFS,FirstCash Holdings Inc. Common Stock,United States,Consumer Discretionary,Other Specialty Stores,37092687.0
FCNCA,First Citizens BancShares Inc. Class A Common Stock,United States,Finance,Major Banks,11036387.0
FCNCO,First Citizens BancShares Inc. 5.625% Non-Cumulative Perpetual Preferred Stock Series C,United States,Finance,Major Banks,11036387.0
FCNCP,First Citizens BancShares Inc. Depositary Shares,United States,Finance,Major Banks,11036387.0
FCO,abrdn Global Income Fund Inc. Common Stock,United States,Finance,Investment Managers,
FCUV,Focus Universal Inc. Common Stock,United States,Industrials,Industrial Machinery/Components,27336554.0
FDBC,Fidelity D & D Bancorp Inc. Common Stock,United States,Finance,Major Banks,4608023.0
FDMT,4D Molecular Therapeutics Inc. Common Stock,United States,Health Care,Biotechnology: Pharmaceutical Preparations,21145500.0
FDS,FactSet Research Systems Inc. Common Stock,United States,Technology,Computer Software: Programming Data Processing,38087866.0
FDUS,Fidus Investment Corporation Common Stock,United States,Finance,Finance/Investors Services,
FEAM,5E Advanced Materials Inc. Common Stock,United States,Industrials,Major Chemicals,256917277.0
FEIM,Frequency Electronics Inc. Common Stock,United States,Industrials,Electrical Products,5760699.0
FELE,Franklin Electric Co. Inc. Common Stock,United States,Consumer Discretionary,Metal Fabrications,39716299.0
FEMY,Femasys Inc. Common Stock,United States,Health Care,Medical/Dental Instruments,12818812.0
FEN,First Trust Energy Income and Growth Fund,United States,Finance,Finance/Investors Services,
FENC,Fennec Pharmaceuticals Inc. Common Stock,United States,Health Care,Pharmaceuticals and Biotechnology,15855930.0
FEXD,Fintech Ecosystem Development Corp. Class A Common Stock,United States,Finance,Blank Checks,4029537.0
FEXDR,Fintech Ecosystem Development Corp. Right,United States,Finance,Blank Checks,
FEXDW,Fintech Ecosystem Development Corp. Warrant,United States,Finance,Blank Checks,
FFBC,First Financial Bancorp. Common Stock,United States,Finance,Major Banks,93017538.0
FFIC,Flushing Financial Corporation Common Stock,United States,Finance,Major Banks,27634202.0
FFIE,Faraday Future Intelligent Electric Inc. Common Stock,United States,Consumer Discretionary,Auto Manufacturing,1288469396.0
FFIEW,Faraday Future Intelligent Electric Inc. Warrant,United States,Consumer Discretionary,Auto Manufacturing,
FFIN,First Financial Bankshares Inc. Common Stock,United States,Finance,Major Banks,135622007.0
FFIV,F5 Inc. Common Stock,United States,Telecommunications,Computer Communications Equipment,52953519.0
FFNW,First Financial Northwest Inc. Common Stock,United States,Finance,Banks,6438138.0
FFWM,First Foundation Inc. Common Stock,United States,Finance,Major Banks,51288764.0
FGBI,First Guaranty Bancshares Inc. Common Stock,United States,Finance,Major Banks,5734517.0
