Symbol,Name,Country,Sector,Industry,float shares
MYO,Myomo Inc. Common Stock,United States,Health Care,Industrial Specialties,14831992.0
MYPS,PLAYSTUDIOS Inc.  Class A Common Stock,United States,Technology,EDP Services,84487928.0
MYPSW,PLAYSTUDIOS Inc. Warrant,United States,Technology,EDP Services,
MYRG,MYR Group Inc. Common Stock,United States,Industrials,Water Sewer Pipeline Comm & Power Line Construction,16351114.0
MYSZ,My Size Inc. Common Stock,Israel,Technology,Computer Software: Prepackaged Software,2114349.0
NAAS,NaaS Technology Inc. American Depositary Shares,China,Consumer Discretionary,Other Specialty Stores,18995073.0
NAII,Natural Alternatives International Inc. Common Stock,United States,Health Care, Medicinal Chemicals and Botanical Products ,4449366.0
NAK,Northern Dynasty Minerals Ltd. Common Stock,Canada,Basic Materials,Precious Metals,518037968.0
NAMS,NewAmsterdam Pharma Company N.V. Ordinary Shares,Netherlands,Health Care,Biotechnology: Pharmaceutical Preparations,18482563.0
NAMSW,NewAmsterdam Pharma Company N.V. Warrant,Netherlands,Health Care,Biotechnology: Pharmaceutical Preparations,
NAOV,NanoVibronix Inc. Common Stock,United States,Health Care,Industrial Specialties,1650627.0
NARI,Inari Medical Inc. Common Stock,United States,Health Care,Medical/Dental Instruments,51262696.0
NATH,Nathan's Famous Inc. Common Stock,United States,Consumer Discretionary,Restaurants,2563655.0
NATI,National Instruments Corporation Common Stock,United States,Technology,Computer Software: Prepackaged Software,124865503.0
NATR,Nature's Sunshine Products Inc. Common Stock,United States,Health Care,Biotechnology: Pharmaceutical Preparations,10996413.0
NAUT,Nautilus Biotechnolgy Inc. Common Stock,United States,Industrials,Biotechnology: Laboratory Analytical Instruments,55224455.0
NAVB,Navidea Biopharmaceuticals Inc. Common Stock,United States,Health Care,Biotechnology: In Vitro & In Vivo Diagnostic Substances,65865723.0
NAVI,Navient Corporation Common Stock,United States,Finance,Investment Bankers/Brokers/Service,87880451.0
NB,NioCorp Developments Ltd. Common Stock,United States,Basic Materials,Metal Mining,27986012.0
NBH,Neuberger Berman Municipal Fund Inc. Common Stock,United States,Finance,Finance/Investors Services,
NBIX,Neurocrine Biosciences Inc. Common Stock,United States,Health Care,Biotechnology: Biological Products (No Diagnostic Substances),96446442.0
NBN,Northeast Bank Common Stock,United States,Finance,Major Banks,6094353.0
NBO,Neuberger Berman New York Municipal Fund Inc. Common Stock,United States,Finance,Finance/Investors Services,
NBSE,NeuBase Therapeutics Inc.  Common Stock,United States,Health Care,Biotechnology: Pharmaceutical Preparations,1501503.0
NBST,Newbury Street Acquisition Corporation Common Stock,United States,Finance,Blank Checks,3589113.0
NBSTW,Newbury Street Acquisition Corporation Warrants,United States,Finance,Blank Checks,
NBTB,NBT Bancorp Inc. Common Stock,United States,Finance,Major Banks,41840627.0
NBTX,Nanobiotix S.A. American Depositary Shares,France,Health Care,Biotechnology: Pharmaceutical Preparations,30499475.0
NBW,Neuberger Berman California Municipal Fund Inc Common Stock,United States,Finance,Finance/Investors Services,
NBY,NovaBay Pharmaceuticals Inc. Common Stock,United States,Health Care,Biotechnology: Pharmaceutical Preparations,3929938.0
NCAC,Newcourt Acquisition Corp Class A Ordinary Share,United States,Finance,Blank Checks,1993636.0
NCACW,Newcourt Acquisition Corp Warrant,United States,Finance,Blank Checks,
NCMI,National CineMedia Inc. Common Stock,United States,Consumer Discretionary,Advertising,11038039.0
NCNA,NuCana plc American Depositary Share,United Kingdom,Health Care,Biotechnology: Pharmaceutical Preparations,34164631.0
NCNO,nCino Inc. Common Stock,United States,Technology,Computer Software: Prepackaged Software,52546987.0
NCPL,Netcapital Inc. Common Stock,United States,Finance,Investment Managers,7509332.0
NCPLW,Netcapital Inc. Warrants,United States,Finance,Investment Managers,
NCRA,Nocera Inc. Common Stock,Taiwan,Consumer Staples,Farming/Seeds/Milling,
NCSM,NCS Multistage Holdings Inc. Common Stock,United States,Energy,Oilfield Services/Equipment,702625.0
NCTY,The9 Limited American Depository Shares,China,Consumer Discretionary,Business Services,27615399.0
NDAQ,Nasdaq Inc. Common Stock,United States,Finance,Investment Bankers/Brokers/Service,339789343.0
NDLS,Noodles & Company Class A Common Stock,United States,Consumer Discretionary,Restaurants,33037143.0
NDRA,ENDRA Life Sciences Inc. Common Stock,United States,Health Care,Biotechnology: Electromedical & Electrotherapeutic Apparatus,7131015.0
NDSN,Nordson Corporation Common Stock,United States,Industrials,Industrial Machinery/Components,51236530.0
NECB,NorthEast Community Bancorp Inc. Common Stock,United States,Finance,Savings Institutions,11702673.0
NEGG,Newegg Commerce Inc. Common Shares,China,Consumer Discretionary,Other Specialty Stores,24550703.0
NEN,New England Realty Associates Limited Partnership Class A Depositary Receipts Evidencing Units of Limited Partnership,United States,Finance,Real Estate,2073132.0
NEO,NeoGenomics Inc. Common Stock,United States,Health Care,Precision Instruments,123249422.0
NEOG,Neogen Corporation Common Stock,United States,Health Care,Biotechnology: In Vitro & In Vivo Diagnostic Substances,216079625.0
NEON,Neonode Inc. Common Stock,Sweden,Technology,Industrial Machinery/Components,11559699.0
NEOV,NeoVolta Inc. Common Stock,United States,Miscellaneous,Industrial Machinery/Components,28276682.0
NEOVW,NeoVolta Inc. Warrant,United States,Miscellaneous,Industrial Machinery/Components,
NEPH,Nephros Inc. Common Stock,United States,Health Care,Medical/Dental Instruments,5655153.0
NEPT,Neptune Wellness Solutions Inc. Ordinary Shares,Canada,Health Care,Biotechnology: Pharmaceutical Preparations,21178146.0
NERV,Minerva Neurosciences Inc Common Stock,United States,Health Care,Biotechnology: Pharmaceutical Preparations,5435625.0
NEWT,NewtekOne Inc. Common Stock,United States,Finance,Finance/Investors Services,23182989.0
NEWTL,NewtekOne Inc. 5.75% Notes due 2024,United States,Finance,Finance/Investors Services,
NEWTZ,NewtekOne Inc. 5.50% Notes Due 2026,United States,Finance,Major Banks,
NEXI,NexImmune Inc. Common Stock,United States,Health Care,Biotechnology: Pharmaceutical Preparations,17310354.0
NEXT,NextDecade Corporation Common Stock,United States,Utilities,Oil & Gas Production,111030419.0
NFBK,Northfield Bancorp Inc. Common Stock (Delaware),United States,Finance,Savings Institutions,43045651.0
NFE,New Fortress Energy Inc. Class A Common Stock,United States,Utilities,Oil/Gas Transmission,54663423.0
NFLX,Netflix Inc. Common Stock,United States,Consumer Discretionary,Consumer Electronics/Video Chains,437221879.0
NFTG,The NFT Gaming Company Inc. Common Stock,United States,Technology,Computer Software: Prepackaged Software,9366370.0
NG,Novagold Resources Inc.,Canada,Basic Materials,Precious Metals,223090382.0
NGD,New Gold Inc.,Canada,Basic Materials,Metal Mining,683144690.0
NGM,NGM Biopharmaceuticals Inc. Common Stock,United States,Health Care,Biotechnology: Biological Products (No Diagnostic Substances),40346970.0
NGMS,NeoGames S.A. Ordinary Shares,Israel,Consumer Discretionary,Services-Misc. Amusement & Recreation,
NHC,National HealthCare Corporation Common Stock,United States,Health Care,Hospital/Nursing Management,12338093.0
NHS,Neuberger Berman High Yield Strategies Fund,United States,Finance,Trusts Except Educational Religious and Charitable,
NHTC,Natural Health Trends Corp. Common Stock,United States,Miscellaneous,Diversified Commercial Services,6275293.0
NHWK,NightHawk Biosciences Inc. Common Stock,United States,Health Care,Biotechnology: Pharmaceutical Preparations,22518582.0
NICE,NICE Ltd American Depositary Shares,Israel,Technology,Computer Manufacturing,1585826509.0
NIOBW,NioCorp Developments Ltd. Warrant,United States,Basic Materials,Metal Mining,
NIR,Near Intelligence Inc. Common Stock,United States,Technology,EDP Services,15228701.0
NISN,NiSun International Enterprise Development Group Co. Ltd. Class A Common Shares,China,Industrials,Metal Fabrications,2731440.0
NIU,Niu Technologies American Depositary Shares,China,Consumer Discretionary,Auto Manufacturing,47662080.0
NKLA,Nikola Corporation Common Stock,United States,Consumer Discretionary,Auto Manufacturing,647206811.0
NKSH,National Bankshares Inc. Common Stock,United States,Finance,Major Banks,5700864.0
NKTR,Nektar Therapeutics  Common Stock,United States,Health Care,Biotechnology: Pharmaceutical Preparations,141815222.0
NKTX,Nkarta Inc. Common Stock,United States,Health Care,Biotechnology: Pharmaceutical Preparations,34434465.0
NLSP,NLS Pharmaceutics Ltd. Ordinary Shares,Switzerland,Health Care,Biotechnology: Pharmaceutical Preparations,14176939.0
NLSPW,NLS Pharmaceutics Ltd. Warrant,Switzerland,Health Care,Biotechnology: Pharmaceutical Preparations,
NLTX,Neoleukin Therapeutics Inc. Common Stock,Canada,Health Care,Biotechnology: Pharmaceutical Preparations,24084564.0
NMFC,New Mountain Finance Corporation Common Stock,United States,Finance,Finance/Investors Services,
NMIH,NMI Holdings Inc. Class A Common Stock,United States,Finance,Property-Casualty Insurers,81080274.0
NMRD,Nemaura Medical Inc. Common Stock,United Kingdom,Health Care,Medical/Dental Instruments,12329930.0
NMRK,Newmark Group Inc. Class A Common Stock,United States,Finance,Real Estate,140798898.0
NMTC,NeuroOne Medical Technologies Corporation Common Stock,United States,Health Care,Medical/Dental Instruments,20497306.0
NN,NextNav Inc. Common Stock,United States,Industrials,Industrial Machinery/Components,32704436.0
NNAVW,NextNav Inc. Warrant,United States,Industrials,Industrial Machinery/Components,
NNBR,NN Inc. Common Stock,United States,Industrials,Industrial Machinery/Components,31562651.0
NNDM,Nano Dimension Ltd. American Depositary Shares,Israel,Technology,Electrical Products,208560649.0
NNOX,NANO-X IMAGING LTD Ordinary Shares,Israel,Health Care,Medical Electronics,48429782.0
NNVC,NanoViricides Inc. Common Stock,United States,Health Care,Biotechnology: Pharmaceutical Preparations,11156662.0
NODK,NI Holdings Inc. Common Stock,United States,Finance,Property-Casualty Insurers,6858435.0
NOGN,Nogin Inc. Common Stock,United States,Technology,EDP Services,6902234.0
NOGNW,Nogin Inc. Warrant ,United States,Technology,EDP Services,
NOTV,Inotiv Inc. Common Stock,United States,Health Care,Biotechnology: Pharmaceutical Preparations,21781518.0
NOVV,Nova Vision Acquisition Corp. Ordinary share,Hong Kong,Finance,Blank Checks,597327.0
NOVVR,Nova Vision Acquisition Corp. Rights,Hong Kong,Finance,Blank Checks,
NOVVU,Nova Vision Acquisition Corp. Unit,Hong Kong,Finance,Blank Checks,597327.0
NPABW,New Providence Acquisition Corp. II Warrant,United States,Finance,Blank Checks,
NPCE,Neuropace Inc. Common Stock,United States,Health Care,Medical Specialities,7286213.0
NRAC,Northern Revival Acquisition Corporation Class A Ordinary Share,United States,Finance,Blank Checks,1879490.0
NRACU,Northern Revival Acquisition Corporation Unit,United States,Finance,Blank Checks,1879490.0
NRACW,Northern Revival Acquisition Corporation Warrant,United States,Finance,Blank Checks,
NRBO,NeuroBo Pharmaceuticals Inc. Common Stock,United States,Health Care,Biotechnology: Pharmaceutical Preparations,36898551.0
NRC,National Research Corporation Common Stock (Delaware),United States,Health Care,Biotechnology: Commercial Physical & Biological Resarch,14406206.0
NRDS,NerdWallet Inc. Class A Common Stock,United States,Technology,EDP Services,39945730.0
NRIM,Northrim BanCorp Inc Common Stock,United States,Finance,Savings Institutions,5418717.0
NRIX,Nurix Therapeutics Inc. Common stock,United States,Health Care,Biotechnology: Pharmaceutical Preparations,36917398.0
NRO,Neuberger Berman Real Estate Securities Income Fund Inc.,United States,Finance,Finance/Investors Services,
NRSN,NeuroSense Therapeutics Ltd. Ordinary Shares,Israel,Health Care,Biotechnology: Pharmaceutical Preparations,7837200.0
NRSNW,NeuroSense Therapeutics Ltd. Warrant,Israel,Health Care,Biotechnology: Pharmaceutical Preparations,
NRXP,NRX Pharmaceuticals Inc. Common Stock,United States,Health Care,Biotechnology: Pharmaceutical Preparations,47090600.0
NSIT,Insight Enterprises Inc. Common Stock,United States,Consumer Discretionary,Catalog/Specialty Distribution,30425203.0
NSPR,InspireMD Inc. Common Stock,Israel,Health Care,Medical/Dental Instruments,8757605.0
NSSC,NAPCO Security Technologies Inc. Common Stock,United States,Telecommunications,Telecommunications Equipment,32861571.0
NSTG,NanoString Technologies Inc. Common Stock,United States,Health Care,Biotechnology: Biological Products (No Diagnostic Substances),41317083.0
NSTS,NSTS Bancorp Inc. Common Stock,United States,Finance,Savings Institutions,5066005.0
NSYS,Nortech Systems Incorporated Common Stock,United States,Technology,Industrial Machinery/Components,863990.0
NTAP,NetApp Inc. Common Stock,United States,Technology,Electronic Components,211421818.0
NTCT,NetScout Systems Inc. Common Stock,United States,Technology,EDP Services,68452227.0
NTES,NetEase Inc. American Depositary Shares,China,Technology,Computer Software: Prepackaged Software,345229234.0
NTGR,NETGEAR Inc. Common Stock,United States,Utilities,Telecommunications Equipment,28413430.0
NTIC,Northern Technologies International Corporation Common Stock,United States,Industrials,Industrial Specialties,7748645.0
NTIP,Network-1 Technologies Inc. Common Stock,United States,Miscellaneous,Multi-Sector Companies,13157966.0
NTLA,Intellia Therapeutics Inc. Common Stock,United States,Health Care,Biotechnology: In Vitro & In Vivo Diagnostic Substances,83805354.0
NTNX,Nutanix Inc. Class A Common Stock,United States,Technology,EDP Services,234224573.0
NTRA,Natera Inc. Common Stock,United States,Health Care,Medical Specialities,109956569.0
NTRB,Nutriband Inc. Common Stock,United States,Health Care,Biotechnology: Pharmaceutical Preparations,4697383.0
NTRBW,Nutriband Inc. Warrant,United States,Health Care,Industrial Specialties,
NTRS,Northern Trust Corporation Common Stock,United States,Finance,Major Banks,204443539.0
NTRSO,Northern Trust Corporation Depositary Shares Each Representing a 1/1000th Interest in a Share of Series E Non-Cumulative Perpetual Preferred Stock,United States,Finance,Major Banks,204443539.0
NTWK,NetSol Technologies Inc. Common  Stock,United States,Technology,Computer Software: Prepackaged Software,9027684.0
NUBI,Nubia Brand International Corp. Class A Common Stock,United States,Finance,Blank Checks,2877917.0
NURO,NeuroMetrix Inc. Common Stock,United States,Health Care,Medical/Dental Instruments,8395143.0
NUTX,Nutex Health Inc. Common Stock,United States,Technology,Retail: Computer Software & Peripheral Equipment,333338399.0
NUVA,NuVasive Inc. Common Stock,United States,Health Care,Medical/Dental Instruments,52308079.0
NUVL,Nuvalent Inc. Class A Common Stock,United States,Health Care,Biotechnology: Pharmaceutical Preparations,22861240.0
NUWE,Nuwellis Inc. Common Stock,United States,Health Care,Biotechnology: Electromedical & Electrotherapeutic Apparatus,1856566.0
NUZE,NuZee Inc. Common Stock,United States,Consumer Discretionary,Other Specialty Stores,508088.0
NVAC,NorthView Acquisition Corporation Common Stock,United States,Health Care,Medical/Dental Instruments,713439.0
NVACR,NorthView Acquisition Corporation Rights,United States,Health Care,Medical/Dental Instruments,713439.0
NVACW,NorthView Acquisition Corporation Warrant,United States,Health Care,Medical/Dental Instruments,
NVAX,Novavax Inc. Common Stock,United States,Health Care,Biotechnology: Biological Products (No Diagnostic Substances),82039125.0
NVCR,NovoCure Limited Ordinary Shares,Jersey,Health Care,Medical/Dental Instruments,95416943.0
NVCT,Nuvectis Pharma Inc. Common Stock,United States,Health Care, Medicinal Chemicals and Botanical Products ,4225717.0
NVDA,NVIDIA Corporation Common Stock,United States,Technology,Semiconductors,2370854200.0
NVEC,NVE Corporation Common Stock,United States,Technology,Semiconductors,4766265.0
NVEE,NV5 Global Inc. Common Stock,United States,Consumer Discretionary,Other Consumer Services,11603699.0
NVEI,Nuvei Corporation Subordinate Voting Shares,Canada,Consumer Discretionary,Business Services,62785042.0
NVFY,Nova Lifestyle Inc. Common Stock,United States,Consumer Discretionary,Home Furnishings,895576.0
NVIV,InVivo Therapeutics Holdings Corp Common Stock,United States,Health Care,Biotechnology: Biological Products (No Diagnostic Substances),2767418.0
NVMI,Nova Ltd. Ordinary Shares,Israel,Technology,Electronic Components,28763986.0
NVNO,enVVeno Medical Corporation Common Stock,United States,Health Care,Medical/Dental Instruments,8596977.0
NVOS,Novo Integrated Sciences Inc. Common Stock,United States,Industrials,Industrial Machinery/Components,129746320.0
NVTS,Navitas Semiconductor Corporation Common Stock,United States,Technology,Semiconductors,117618770.0
NVVE,Nuvve Holding Corp. Common Stock,China,Energy,Oil Refining/Marketing,22035579.0
NVVEW,Nuvve Holding Corp. Warrant,China,Energy,Oil Refining/Marketing,
NVX,NOVONIX Limited American Depository Shares,Australia,Miscellaneous,Industrial Machinery/Components,84693916.0
NWBI,Northwest Bancshares Inc. Common Stock,United States,Finance,Major Banks,125752206.0
NWE,NorthWestern Corporation Common Stock,United States,Utilities,Power Generation,59703774.0
NWFL,Norwood Financial Corp. Common Stock,United States,Finance,Major Banks,7140407.0
NWL,Newell Brands Inc. Common Stock,United States,Industrials,Plastic Products,412713022.0
NWLI,National Western Life Group Inc. Class A Common Stock,United States,Finance,Life Insurance,4473250.0
NWPX,Northwest Pipe Company Common Stock,United States,Industrials,Steel/Iron Ore,9692240.0
NWS,News Corporation Class B Common Stock,United States,Consumer Discretionary,Newspapers/Magazines,490943106.0
NWSA,News Corporation Class A Common Stock,United States,Consumer Discretionary,Newspapers/Magazines,490943106.0
NWTN,NWTN Inc. Class B Ordinary Shares,United Arab Emirates,Consumer Discretionary,Auto Manufacturing,246442938.0
NWTNW,NWTN Inc. Warrant,United Arab Emirates,Consumer Discretionary,Auto Manufacturing,
NXGL,NexGel Inc Common Stock,United States,Health Care,Medical/Dental Instruments,4505245.0
NXGLW,NexGel Inc Warrant,United States,Health Care,Medical/Dental Instruments,
NXGN,NextGen Healthcare Inc. Common Stock,United States,Technology,EDP Services,54452459.0
NXL,Nexalin Technology Inc. Common Stock,United States,Health Care,Medical Specialities,5695291.0
NXPI,NXP Semiconductors N.V. Common Stock,Netherlands,Technology,Semiconductors,257301998.0
NXPL,NextPlat Corp Common Stock,United States,Telecommunications,Telecommunications Equipment,7595215.0
NXPLW,NextPlat Corp Warrants,United States,Telecommunications,Telecommunications Equipment,
NXST,Nexstar Media Group Inc. Common Stock,United States,Industrials,Broadcasting,33173399.0
NXT,Nextracker Inc. Class A Common Stock,United States,Technology,Semiconductors,49127383.0
NXTC,NextCure Inc. Common Stock,United States,Health Care,Biotechnology: Pharmaceutical Preparations,18577611.0
NXTP,NextPlay Technologies Inc. Common Stock,United States,Technology,EDP Services,4445001.0
NXU,Nxu Inc. Class A Common Stock,United States,Consumer Discretionary,Automotive Aftermarket,4626315.0
NYMT,New York Mortgage Trust Inc. Common Stock,United States,Real Estate,Real Estate Investment Trusts,89948256.0
NYMTL,New York Mortgage Trust Inc. 6.875% Series F Fixed-to-Floating Rate Cumulative Redeemable Preferred Stock $0.01 par value per share,United States,Real Estate,Real Estate Investment Trusts,89948256.0
NYMTM,New York Mortgage Trust Inc. 7.875% Series E Fixed-to-Floating Rate Cumulative Redeemable Preferred Stock,United States,Real Estate,Real Estate Investment Trusts,89948256.0
NYMTN,New York Mortgage Trust Inc. 8.00% Series D Fixed-to-Floating Rate Cumulative Redeemable Preferred Stock,United States,Real Estate,Real Estate Investment Trusts,89948256.0
NYMTZ,New York Mortgage Trust Inc. 7.000% Series G Cumulative Redeemable Preferred Stock $0.01 par value per share,United States,Real Estate,Real Estate Investment Trusts,89948256.0
NYXH,Nyxoah SA Ordinary Shares,Belgium,Health Care,Medical/Dental Instruments,11828801.0
OABI,OmniAb Inc. Common Stock,United States,Health Care,Biotechnology: Pharmaceutical Preparations,95270725.0
OAKUR,Oak Woods Acquisition Corporation Right,Canada,Finance,Blank Checks,
OAKUU,Oak Woods Acquisition Corporation Unit,Canada,Finance,Blank Checks,6093104.0
OAKUW,Oak Woods Acquisition Corporation Warrant,Canada,Finance,Blank Checks,
OB,Outbrain Inc. Common Stock,United States,Industrials,Industrial Machinery/Components,25051599.0
OBIO,Orchestra BioMed Holdings Inc. Ordinary Shares,United States,Health Care, Medicinal Chemicals and Botanical Products ,20600906.0
OBLG,Oblong Inc. Common Stock,United States,Technology,Computer Software: Programming Data Processing,2751693.0
OBT,Orange County Bancorp Inc. Common Stock,United States,Finance,Major Banks,3712239.0
OCAX,OCA Acquisition Corp. Class A Common Stock,United States,Finance,Blank Checks,3300703.0
OCAXW,OCA Acquisition Corp. Warrant,United States,Finance,Blank Checks,
OCC,Optical Cable Corporation Common Stock,United States,Industrials,Telecommunications Equipment,5146935.0
OCCI,OFS Credit Company Inc. Common Stock,United States,Finance,Trusts Except Educational Religious and Charitable,
OCCIN,OFS Credit Company Inc. 5.25% Series E Term Preferred Stock Due 2026,United States,Finance,Trusts Except Educational Religious and Charitable,
OCCIO,OFS Credit Company Inc. 6.125% Series C Term Preferred Stock,United States,Finance,Trusts Except Educational Religious and Charitable,
OCEA,Ocean Biomedical Inc. Common Stock,United States,Health Care,Biotechnology: Pharmaceutical Preparations,3906215.0
OCEAW,Ocean Biomediacal Inc. Warrants,United States,Health Care,Biotechnology: Pharmaceutical Preparations,
OCFC,OceanFirst Financial Corp. Common Stock,United States,Finance,Savings Institutions,57418376.0
OCFCP,OceanFirst Financial Corp. Depositary Shares,United States,Finance,Savings Institutions,57418376.0
OCG,Oriental Culture Holding LTD Ordinary Shares,China,Consumer Discretionary,Other Consumer Services,14531999.0
OCGN,Ocugen Inc. Common Stock,United States,Health Care,Biotechnology: Biological Products (No Diagnostic Substances),252795474.0
OCS,Oculis Holding AG Ordinary shares,Switzerland,Health Care,Biotechnology: Pharmaceutical Preparations,1428979.0
OCSAW,Oculis Holding AG Warrants,Switzerland,Health Care,Biotechnology: Pharmaceutical Preparations,
OCSL,Oaktree Specialty Lending Corporation Common Stock,United States,Finance,Finance: Consumer Services,
OCUL,Ocular Therapeutix Inc. Common Stock,United States,Health Care,Biotechnology: Pharmaceutical Preparations,70709802.0
OCUP,Ocuphire Pharma Inc. Common Stock,United States,Health Care,Biotechnology: Pharmaceutical Preparations,20197336.0
OCX,Oncocyte Corporation Common Stock,United States,Health Care,Biotechnology: In Vitro & In Vivo Diagnostic Substances,3608867.0
ODFL,Old Dominion Freight Line Inc. Common Stock,United States,Industrials,Trucking Freight/Courier Services,97517392.0
ODP,The ODP Corporation Common Stock,United States,Consumer Discretionary,Other Specialty Stores,34016959.0
ODVWW,Osisko Development Corp. Warrant,Canada,Basic Materials,Precious Metals,
OESX,Orion Energy Systems Inc. Common Stock,United States,Consumer Discretionary,Building Products,26962822.0
OFIX,Orthofix Medical Inc. Common Stock (DE),Curacao,Health Care,Medical/Dental Instruments,31060350.0
OFLX,Omega Flex Inc. Common Stock,United States,Industrials,Industrial Specialties,3317196.0
OFS,OFS Capital Corporation Common Stock,United States,Finance,Finance/Investors Services,
OFSSH,OFS Capital Corporation 4.95% Notes due 2028,United States,Finance,Finance Companies,
OGEN,Oragenics Inc. Common Stock,United States,Health Care,Biotechnology: Pharmaceutical Preparations,2360358.0
OGI,Organigram Holdings Inc. Common Shares,Canada,Health Care,Biotechnology: Pharmaceutical Preparations,65182207.0
OHAA,OPY Acquisition Corp. I Class A Common Stock,United States,Finance,Blank Checks,2478422.0
OHAAW,OPY Acquisition Corp. I Warrant,United States,Finance,Blank Checks,
OIG,Orbital Infrastructure Group Inc. Common Stock,United States,Technology,Electronic Components,3644134.0
OKTA,Okta Inc. Class A Common Stock,United States,Technology,Computer Software: Prepackaged Software,153795573.0
OKYO,OKYO Pharma Limited Ordinary Shares,Guernsey,Health Care,Biotechnology: Biological Products (No Diagnostic Substances),9990052.0
OLB,The OLB Group Inc. Common Stock,United States,Technology,EDP Services,
OLED,Universal Display Corporation Common Stock,United States,Technology,Semiconductors,46335095.0
OLIT,OmniLit Acquisition Corp. Class A Common Stock,United States,Finance,Blank Checks,1348036.0
OLITW,OmniLit Acquisition Corp. Warrants.,United States,Finance,Blank Checks,
OLK,Olink Holding AB (publ) American Depositary Shares,Sweden,Industrials,Biotechnology: Laboratory Analytical Instruments,40697371.0
OLLI,Ollie's Bargain Outlet Holdings Inc. Common Stock,United States,Consumer Discretionary,Department/Specialty Retail Stores,57639445.0
OLMA,Olema Pharmaceuticals Inc. Common Stock,United States,Health Care,Biotechnology: Pharmaceutical Preparations,20042949.0
OLPX,Olaplex Holdings Inc. Common Stock,United States,Consumer Discretionary,Package Goods/Cosmetics,152590535.0
OM,Outset Medical Inc. Common Stock,United States,Health Care,Biotechnology: Electromedical & Electrotherapeutic Apparatus,47844908.0
OMAB,Grupo Aeroportuario del Centro Norte S.A.B. de C.V. ADS,Mexico,Consumer Discretionary,Aerospace,33792238.0
OMCL,Omnicell Inc. Common Stock ($0.001 par value),United States,Technology,Computer Manufacturing,44388731.0
