Symbol,Name,Country,Sector,Industry,float shares
RZB,Reinsurance Group of America Incorporated 5.75% Fixed-To-Floating Rate Subordinated Debentures due 2056,United States,Finance,Life Insurance,65832405.0
RZC,Reinsurance Group of America Incorporated 7.125% Fixed-Rate Reset Subordinated Debentures due 2052,United States,Finance,Life Insurance,
S,SentinelOne Inc. Class A Common Stock,United States,Technology,EDP Services,226408640.0
SA,Seabridge Gold Inc. Ordinary Shares (Canada),Canada,Basic Materials,Precious Metals,76132922.0
SAFE,Safehold Inc. New Common Stock ,United States,Real Estate,Real Estate Investment Trusts,43253542.0
SAH,Sonic Automotive Inc. Common Stock,United States,Consumer Discretionary,Retail-Auto Dealers and Gas Stations,15596600.0
SAIC,SCIENCE APPLICATIONS INTERNATIONAL CORPORATION Common Stock,United States,Technology,EDP Services,53114491.0
SAJ,Saratoga Investment Corp 8.00% Notes due 2027,United States,Finance,Investment Managers,
SAM,Boston Beer Company Inc. (The) Common Stock,United States,Consumer Staples,Beverages (Production/Distribution),9415018.0
SAN,Banco Santander S.A. Sponsored ADR (Spain),Spain,Finance,Commercial Banks,15984390186.0
SAND          ,Sandstorm Gold Ltd. Ordinary Shares (Canada),Canada,Basic Materials,Precious Metals,244635945.0
SAP,SAP  SE ADS,Germany,Technology,EDP Services,1030240396.0
SAR,Saratoga Investment Corp New,United States,Finance,Investment Managers,10132978.0
SAT,Saratoga Investment Corp 6.00% Notes due 2027,United States,Finance,Investment Managers,
SAVE,Spirit Airlines Inc. Common Stock,United States,Consumer Discretionary,Air Freight/Delivery Services,108543116.0
SAY,Saratoga Investment Corp 8.125% Notes due 2027,United States,Finance,Investment Managers,
SAZ,Saratoga Investment Corp 8.50% Notes due 2028,United States,Finance,Investment Managers,
SB,Safe Bulkers Inc Common Stock ($0.001 par value),Monaco,Consumer Discretionary,Marine Transportation,62584295.0
SBBA,Scorpio Tankers Inc. 7.00% Senior Notes due 2025,Monaco,Consumer Discretionary,Marine Transportation,
SBH,Sally Beauty Holdings Inc. (Name to be changed from Sally Holdings Inc.) Common Stock,United States,Consumer Discretionary,Other Specialty Stores,99935784.0
SBI,Western Asset Intermediate Muni Fund Inc Common Stock,United States,Finance,Finance/Investors Services,
SBOW,SilverBow Resorces Inc. Common Stock,United States,Energy,Oil & Gas Production,10575651.0
SBR,Sabine Royalty Trust Common Stock,United States,Energy,Oil & Gas Production,13970512.0
SBS,Companhia de saneamento Basico Do Estado De Sao Paulo - Sabesp American Depositary Shares (Each repstg 250 Common Shares),Brazil,Utilities,Water Supply,339991479.0
SBSW,D/B/A Sibanye-Stillwater Limited ADS,South Africa,Basic Materials,Precious Metals,1145672100.0
SCCO,Southern Copper Corporation Common Stock,United States,Basic Materials,Metal Mining,85065081.0
SCD,LMP Capital and Income Fund Inc. Common Stock,United States,Finance,Trusts Except Educational Religious and Charitable,
SCHW,Charles Schwab Corporation (The) Common Stock,United States,Finance,Investment Bankers/Brokers/Service,1488741899.0
SCI,Service Corporation International Common Stock,United States,Consumer Discretionary,Other Consumer Services,146959235.0
SCL,Stepan Company Common Stock,United States,Consumer Discretionary,Package Goods/Cosmetics,21175944.0
SCM,Stellus Capital Investment Corporation Common Stock,United States,Finance,Finance/Investors Services,
SCS,Steelcase Inc. Common Stock,United States,Consumer Discretionary,Office Equipment/Supplies/Services,81675211.0
SCU,Sculptor Capital Management Inc. Class A Common Stock,United States,Finance,Investment Managers,17980674.0
SCX,L.S. Starrett Company (The) Common Stock,United States,Consumer Discretionary,Industrial Machinery/Components,6299909.0
SD,SandRidge Energy Inc. Common Stock,United States,Energy,Oil & Gas Production,36342854.0
SE,Sea Limited American Depositary Shares each representing one Class A Ordinary Share,United States,Consumer Discretionary,Other Consumer Services,285493161.0
SEAS,SeaWorld Entertainment Inc. Common Stock,United States,Health Care,Biotechnology: Electromedical & Electrotherapeutic Apparatus,36161742.0
SEE,Sealed Air Corporation Common Stock,United States,Industrials,Major Chemicals,143194216.0
SEM,Select Medical Holdings Corporation Common Stock,United States,Health Care,Hospital/Nursing Management,103985515.0
SEMR,SEMrush Holdings Inc. Class A Common Stock,United States,Technology,EDP Services,20360134.0
SF,Stifel Financial Corporation Common Stock,United States,Finance,Investment Bankers/Brokers/Service,100742764.0
SFB,Stifel Financial Corporation 5.20% Senior Notes due 2047,United States,Finance,Investment Bankers/Brokers/Service,
SFBS,ServisFirst Bancshares Inc. Common Stock,United States,Finance,Major Banks,49094752.0
SFL,SFL Corporation Ltd,Bermuda,Consumer Discretionary,Marine Transportation,100438082.0
SG,Sweetgreen Inc. Class A Common Stock,United States,Consumer Discretionary,Restaurants,95172294.0
SGU,Star Group L.P. Common Stock,United States,Consumer Discretionary,Other Specialty Stores,26591546.0
SHAK,Shake Shack Inc. Class A Common Stock,United States,Consumer Discretionary,Restaurants,37414775.0
SHEL,Shell PLC American Depositary Shares (each representing two (2) Ordinary Shares) ,Netherlands,Energy,Oil & Gas Production,3288466725.0
SHG,Shinhan Financial Group Co Ltd American Depositary Shares,South Korea,Finance,Major Banks,459910907.0
SHO,Sunstone Hotel Investors Inc. Sunstone Hotel Investors Inc. Common Shares,United States,Real Estate,Real Estate Investment Trusts,205027898.0
SHOP,Shopify Inc. Class A Subordinate Voting Shares,Canada,Technology,Computer Software: Prepackaged Software,1201201129.0
SHW,Sherwin-Williams Company (The) Common Stock,United States,Consumer Discretionary,RETAIL: Building Materials,235491840.0
SID,Companhia Siderurgica Nacional S.A. Common Stock,Brazil,Industrials,Steel/Iron Ore,600866428.0
SIG,Signet Jewelers Limited Common Shares,Bermuda,Consumer Discretionary,Consumer Specialties,34890268.0
SITC,SITE Centers Corp. Common Stock,United States,Real Estate,Real Estate Investment Trusts,187953009.0
SITE,SiteOne Landscape Supply Inc. Common Stock,United States,Consumer Discretionary,Professional and commerical equipment,44399662.0
SIX,Six Flags Entertainment Corporation New Common Stock,United States,Consumer Discretionary,Services-Misc. Amusement & Recreation,71585563.0
SJM,J.M. Smucker Company (The) New Common Stock,United States,Consumer Staples,Packaged Foods,98688259.0
SJT,San Juan Basin Royalty Trust Common Stock,United States,Energy,Oil & Gas Production,44193528.0
SJW,SJW Group Common Stock (DE),United States,Utilities,Water Supply,28940863.0
SKIL,Skillsoft Corp. Class A Common Stock,United States,Technology,Computer Software: Prepackaged Software,81300580.0
SKM,SK Telecom Co. Ltd. Common Stock,South Korea,Telecommunications,Telecommunications Equipment,270513850.0
SKT,Tanger Factory Outlet Centers Inc. Common Stock,United States,Real Estate,Real Estate Investment Trusts,102316217.0
SKX,Skechers U.S.A. Inc. Common Stock,United States,Consumer Discretionary,Shoe Manufacturing,132830027.0
SKY,Skyline Champion Corporation Common Stock,United States,Consumer Discretionary,Homebuilding,53136340.0
SLB,Schlumberger N.V. Common Stock,France,Energy,Oilfield Services/Equipment,1417291966.0
SLCA,U.S. Silica Holdings Inc. Common Stock,United States,Industrials,Mining & Quarrying of Nonmetallic Minerals (No Fuels),70563365.0
SLF,Sun Life Financial Inc. Common Stock,Canada,Finance,Life Insurance,586802224.0
SLG,SL Green Realty Corp Common Stock,United States,Real Estate,Real Estate Investment Trusts,64133640.0
SLGN,Silgan Holdings Inc. Common Stock,United States,Industrials,Containers/Packaging,83906718.0
SLVM,Sylvamo Corporation Common Stock,United States,Basic Materials,Paper,35306467.0
SM,SM Energy Company Common Stock,United States,Energy,Oil & Gas Production,116362231.0
SMAR,Smartsheet Inc. Class A Common Stock,United States,Technology,Computer Software: Prepackaged Software,129231325.0
SMFG,Sumitomo Mitsui Financial Group Inc Unsponsored American Depositary Shares (Japan),Japan,Finance,Commercial Banks,6070315665.0
SMG,Scotts Miracle-Gro Company (The) Common Stock,United States,Industrials,Agricultural Chemicals,41557236.0
SMHI,SEACOR Marine Holdings Inc. Common Stock ,United States,Consumer Discretionary,Marine Transportation,23850102.0
SMLP,Summit Midstream Partners LP Common Units Representing Limited Partner Interests,United States,Utilities,Natural Gas Distribution,9967471.0
SMP,Standard Motor Products Inc. Common Stock,United States,Consumer Discretionary,Auto Parts:O.E.M.,19262894.0
SMRT,SmartRent Inc. Class A Common Stock,United States,Technology,EDP Services,159074457.0
SNA,Snap-On Incorporated Common Stock,United States,Consumer Discretionary,Industrial Machinery/Components,51929654.0
SNAP,Snap Inc. Class A Common Stock,United States,Technology,Computer Software: Programming Data Processing,1010197763.0
SNDA,Sonida Senior Living Inc. Common Stock,United States,Health Care,Hospital/Nursing Management,1063290.0
SNDR,Schneider National Inc. Common Stock,United States,Industrials,Trucking Freight/Courier Services,67914145.0
SNN,Smith & Nephew SNATS Inc. Common Stock,United Kingdom,Health Care,Industrial Specialties,2160040607.0
SNOW,Snowflake Inc. Class A Common Stock,United States,Technology,Computer Software: Prepackaged Software,282378811.0
SNV,Synovus Financial Corp. Common Stock,United States,Finance,Major Banks,144154368.0
SNX,TD SYNNEX Corporation Common Stock,United States,Technology,Retail: Computer Software & Peripheral Equipment,47400195.0
SO,Southern Company (The) Common Stock,United States,Utilities,Power Generation,1087482143.0
SOI,Solaris Oilfield Infrastructure Inc. Class A Common Stock,United States,Industrials,Metal Fabrications,28744606.0
SOJC,Southern Company (The) Series 2017B 5.25% Junior Subordinated Notes due December 1 2077,United States,Utilities,Power Generation,
SOJD,Southern Company (The) Series 2020A 4.95% Junior Subordinated Notes due January 30 2080,United States,Utilities,Power Generation,
SOJE,Southern Company (The) Series 2020C 4.20% Junior Subordinated Notes due October 15 2060,United States,Basic Materials,Metal Mining,
SOL,Emeren Group Ltd American Depositary Shares each representing 10 shares,China,Technology,Semiconductors,39191861.0
SON,Sonoco Products Company Common Stock,United States,Consumer Discretionary,Containers/Packaging,97110858.0
SONY,Sony Group Corporation American Depositary Shares ,Japan,Consumer Staples,Consumer Electronics/Appliances,1203503464.0
SOR,Source Capital Inc. Common Stock,United States,Finance,Investment Managers,
SPB,Spectrum Brands Holdings Inc. Common Stock,United States,Miscellaneous,Industrial Machinery/Components,34747665.0
SPCE,Virgin Galactic Holdings Inc. Common Stock,United States,Consumer Discretionary,Transportation Services,334028220.0
SPE,Special Opportunities Fund Inc Common Stock,United States,Finance,Finance/Investors Services,
SPG,Simon Property Group Inc. Common Stock,United States,Real Estate,Real Estate Investment Trusts,324146273.0
SPGI,S&P Global Inc. Common Stock,United States,Finance,Finance: Consumer Services,317652696.0
SPH,Suburban Propane Partners L.P. Common Stock,United States,Consumer Discretionary,Other Specialty Stores,61277901.0
SPHR,Sphere Entertainment Co. Class A Common Stock,United States,Consumer Discretionary,Movies/Entertainment,26856322.0
SPLP,Steel Partners Holdings LP LTD PARTNERSHIP UNIT,United States,Industrials,Industrial Specialties,4839519.0
SPNT,SiriusPoint Ltd. Common Shares,Bermuda,Finance,Property-Casualty Insurers,90732799.0
SPOT,Spotify Technology S.A. Ordinary Shares,Luxembourg,Consumer Discretionary,Broadcasting,141149875.0
SPR,Spirit Aerosystems Holdings Inc. Common Stock,United States,Industrials,Military/Government/Technical,104393341.0
SPRU,Spruce Power Holding Corporation Class A Common Stock,United States,Consumer Discretionary,Auto Parts:O.E.M.,117025056.0
SPXC,SPX Technologies Inc. Common Stock,United States,Industrials,Industrial Machinery/Components,44662239.0
SPXX,Nuveen S&P 500 Dynamic Overwrite Fund,United States,Finance,Trusts Except Educational Religious and Charitable,
SQ,Block Inc. Class A Common Stock,United States,Technology,Computer Software: Prepackaged Software,546012091.0
SQM,Sociedad Quimica y Minera S.A. Common Stock,Chile,Industrials,Mining & Quarrying of Nonmetallic Minerals (No Fuels),197689927.0
SQNS,Sequans Communications S.A. American Depositary Shares,France,Technology,Semiconductors,16219810.0
SQSP,Squarespace Inc. Class A Common Stock,United States,Technology,Computer Software: Prepackaged Software,45098191.0
SR,Spire Inc. Common Stock,United States,Utilities,Oil/Gas Transmission,51015049.0
SRC,Spirit Realty Capital Inc. Common Stock,United States,Real Estate,Building operators,140425424.0
SRE,DBA Sempra Common Stock,United States,Utilities,Oil/Gas Transmission,314401842.0
SREA,DBA Sempra 5.750% Junior Subordinated Notes due 2079,United States,Consumer Discretionary,Professional Services,
SRG,Seritage Growth Properties Class A Common Stock,United States,Real Estate,Real Estate Investment Trusts,33142632.0
SRI,Stoneridge Inc. Common Stock,United States,Consumer Discretionary,Auto Parts:O.E.M.,24342786.0
SRL,Scully Royalty Ltd.,Canada,Consumer Discretionary,Professional Services,10962982.0
SRT,StarTek Inc. Common Stock,United States,Consumer Discretionary,Professional Services,7955980.0
SRV,NXG Cushing Midstream Energy Fund Common Shares of Beneficial Interest,United States,Finance,Finance Companies,
SSD,Simpson Manufacturing Company Inc. Common Stock,United States,Consumer Discretionary,Industrial Machinery/Components,42472286.0
SSL,Sasol Ltd. American Depositary Shares,South Africa,Energy,Oil & Gas Production,465102308.0
SST,System1 Inc. Class A Common Stock,United States,Consumer Discretionary,Diversified Commercial Services,18863654.0
SSTK,Shutterstock Inc. Common Stock,United States,Technology,EDP Services,24610016.0
ST,Sensata Technologies Holding plc Ordinary Shares,Netherlands,Industrials,Industrial Machinery/Components,142254339.0
STAG,Stag Industrial Inc. Common Stock,United States,Real Estate,Real Estate Investment Trusts,179287024.0
STC,Stewart Information Services Corporation Common Stock,United States,Finance,Specialty Insurers,26867294.0
STE,STERIS plc (Ireland) Ordinary Shares,United States,Health Care,Industrial Specialties,98447525.0
STEL,Stellar Bancorp Inc. Common Stock,United States,Finance,Major Banks,45443679.0
STEM,Stem Inc. Class A Common Stock,United States,Technology,Computer Software: Prepackaged Software,147773913.0
STEW,SRH Total Return Fund Inc. Common Stock,United States,Finance,Investment Managers,
STK,Columbia Seligman Premium Technology Growth Fund Inc,United States,Finance,Investment Managers,
STLA,Stellantis N.V. Common Shares,United Kingdom,Consumer Discretionary,Auto Manufacturing,2106264071.0
STM,STMicroelectronics N.V. Common Stock,Switzerland,Technology,Semiconductors,656080046.0
STN,Stantec Inc Common Stock,Canada,Consumer Discretionary,Marine Transportation,99393336.0
STNG,Scorpio Tankers Inc. Common Shares,Monaco,Consumer Discretionary,Marine Transportation,42249931.0
STR,Sitio Royalties Corp. Class A Common Stock,United States,Energy,Oil & Gas Production,80946818.0
STT,State Street Corporation Common Stock,United States,Finance,Major Banks,300872936.0
STWD,STARWOOD PROPERTY TRUST INC. Starwood Property Trust Inc.,United States,Real Estate,Real Estate Investment Trusts,297097687.0
STZ,Constellation Brands Inc. Common Stock,United States,Consumer Staples,Beverages (Production/Distribution),166594689.0
SUI,Sun Communities Inc. Common Stock,United States,Real Estate,Real Estate Investment Trusts,122553830.0
SUM,Summit Materials Inc. Class A Common Stock,United States,Industrials,Mining & Quarrying of Nonmetallic Minerals (No Fuels),118305033.0
SUN,Sunoco LP Common Units representing limited partner interests,United States,Energy,Integrated oil Companies,55130733.0
SUNL,Sunlight Financial Holdings Inc. Class A Common Stock,United States,Finance,Diversified Financial Services,41293070.0
SUP,Superior Industries International Inc. Common Stock (DE),United States,Consumer Discretionary,Auto Parts:O.E.M.,21247522.0
SWI,SolarWinds Corporation Common Stock,United States,Technology,Computer Software: Prepackaged Software,50803630.0
SWK,Stanley Black & Decker Inc. Common Stock,United States,Consumer Discretionary,Industrial Machinery/Components,152833181.0
SWN,Southwestern Energy Company Common Stock,United States,Energy,Oil & Gas Production,1093339014.0
SWX,Southwest Gas Holdings Inc. Common Stock (DE),United States,Utilities,Oil & Gas Production,70799009.0
SWZ,Swiss Helvetia Fund Inc. (The) Common Stock,United States,Finance,Finance Companies,
SXC,SunCoke Energy Inc. Common Stock,United States,Industrials,Steel/Iron Ore,82633884.0
SXI,Standex International Corporation Common Stock,United States,Industrials,Industrial Machinery/Components,11620964.0
SXT,Sensient Technologies Corporation Common Stock,United States,Industrials,Major Chemicals,41677418.0
SYF,Synchrony Financial Common Stock,United States,Finance,Finance: Consumer Services,415009051.0
SYK,Stryker Corporation Common Stock,United States,Health Care,Medical/Dental Instruments,339153396.0
SYY,Sysco Corporation Common Stock,United States,Consumer Discretionary,Food Distributors,504041228.0
T,AT&T Inc.,United States,Telecommunications,Telecommunications Equipment,7136560740.0
TAC,TransAlta Corporation Ordinary Shares,Canada,Utilities,Electric Utilities: Central,246797032.0
TAL,TAL Education Group American Depositary Shares,China,Consumer Discretionary,Educational Services,431452077.0
TALO,Talos Energy Inc. Common Stock,United States,Energy,Oil & Gas Production,100326540.0
TAP,Molson Coors Beverage Company Class B Common Stock,Canada,Consumer Staples,Beverages (Production/Distribution),193749068.0
TARO,Taro Pharmaceutical Industries Ltd. Ordinary Shares,Israel,Health Care,Biotechnology: Pharmaceutical Preparations,8084886.0
TBB,AT&T Inc. 5.350% Global Notes due 2066,United States,Telecommunications,Telecommunications Equipment,
TBC,AT&T Inc. 5.625% Global Notes due 2067,United States,Telecommunications,Telecommunications Equipment,
TBI,TrueBlue Inc. Common Stock,United States,Consumer Discretionary,Professional Services,27793015.0
TCI,Transcontinental Realty Investors Inc. Common Stock,United States,Real Estate,Real Estate Investment Trusts,1246135.0
TCS,Container Store (The) Common Stock,United States,Consumer Discretionary,Home Furnishings,33861861.0
TD,Toronto Dominion Bank (The) Common Stock,Canada,Finance,Commercial Banks,1798659705.0
TDC,Teradata Corporation Common Stock,United States,Technology,Computer Software: Prepackaged Software,98685216.0
TDF,Templeton Dragon Fund Inc. Common Stock,United States,Finance,Finance/Investors Services,
TDG,Transdigm Group Incorporated Common Stock,United States,Industrials,Military/Government/Technical,54912763.0
TDOC,Teladoc Health Inc. Common Stock,United States,Health Care,Medical/Nursing Services,163713324.0
TDS,Telephone and Data Systems Inc. Common Shares,United States,Telecommunications,Telecommunications Equipment,81418952.0
TDW,Tidewater Inc. Common Stock,United States,Consumer Discretionary,Marine Transportation,48610541.0
TDY,Teledyne Technologies Incorporated Common Stock,United States,Industrials,Industrial Machinery/Components,46407093.0
TECK,Teck Resources Ltd Ordinary Shares,Canada,Industrials,Mining & Quarrying of Nonmetallic Minerals (No Fuels),460360870.0
TEF,Telefonica SA Common Stock,Spain,Telecommunications,Telecommunications Equipment,5647197400.0
TEI,Templeton Emerging Markets Income Fund Inc. Common Stock,United States,Finance,Finance Companies,
TEL,TE Connectivity Ltd. New Switzerland Registered Shares,Switzerland,Technology,Electronic Components,313266793.0
TEO,Telecom Argentina SA,Argentina,Telecommunications,Telecommunications Equipment,
TEVA,Teva Pharmaceutical Industries Limited American Depositary Shares,Israel,Health Care,Biotechnology: Pharmaceutical Preparations,1115114134.0
TEX,Terex Corporation Common Stock,United States,Industrials,Construction/Ag Equipment/Trucks,65483818.0
TFC,Truist Financial Corporation Common Stock,United States,Finance,Major Banks,1326901190.0
TFX,Teleflex Incorporated Common Stock,United States,Health Care,Medical/Dental Instruments,46867630.0
TG,Tredegar Corporation Common Stock,United States,Industrials,Metal Fabrications,23268835.0
TGH,Textainer Group Holdings Limited Common Shares,Bermuda,Consumer Discretionary,Diversified Commercial Services,39438936.0
TGI,Triumph Group Inc. Common Stock,United States,Industrials,Aerospace,75372333.0
TGLS,Tecnoglass Inc. Ordinary Shares,Colombia,Consumer Discretionary,Electronic Components,22419862.0
TGNA,TEGNA Inc,United States,Industrials,Broadcasting,199325415.0
TGS,Transportadora de Gas del Sur SA TGS Common Stock,Argentina,Utilities,Natural Gas Distribution,31370564.0
TGT,Target Corporation Common Stock,United States,Consumer Discretionary,Department/Specialty Retail Stores,460183526.0
THC,Tenet Healthcare Corporation Common Stock,United States,Health Care,Hospital/Nursing Management,93416390.0
THG,Hanover Insurance Group Inc,United States,Finance,Property-Casualty Insurers,35361298.0
THO,Thor Industries Inc. Common Stock,United States,Industrials,Homebuilding,48185258.0
THQ,Tekla Healthcare Opportunies Fund Shares of Beneficial Interest,United States,Finance,Finance Companies,
THR,Thermon Group Holdings Inc. Common Stock,United States,Energy,Industrial Machinery/Components,31391089.0
THS,Treehouse Foods Inc. Common Stock,United States,Consumer Staples,Packaged Foods,51042297.0
THW,Tekla World Healthcare Fund Shares of Beneficial Interest,United States,Finance,Finance Companies,
TISI,Team Inc. Common Stock,United States,Consumer Discretionary,Other Consumer Services,2873067.0
TJX,TJX Companies Inc. (The) Common Stock,United States,Consumer Discretionary,Clothing/Shoe/Accessory Stores,1158840540.0
TK,Teekay Corporation Common Stock,Bermuda,Consumer Discretionary,Marine Transportation,59002606.0
TKC,Turkcell Iletisim Hizmetleri AS Common Stock,Turkey,Telecommunications,Telecommunications Equipment,467634571.0
TKR,Timken Company (The) Common Stock,United States,Industrials,Metal Fabrications,67789475.0
TLK,PT Telekomunikasi Indonesia Tbk,Indonesia,Telecommunications,Telecommunications Equipment,786633250.0
TLYS,Tilly's Inc. Common Stock,United States,Consumer Discretionary,Clothing/Shoe/Accessory Stores,11863683.0
TM,Toyota Motor Corporation Common Stock,Japan,Consumer Discretionary,Auto Manufacturing,16159604853.0
TME,Tencent Music Entertainment Group American Depositary Shares each representing two Class A Ordinary Shares,United States,Consumer Discretionary,Broadcasting,763277810.0
TMHC,Taylor Morrison Home Corporation Common Stock,United States,Consumer Discretionary,Homebuilding,105540792.0
TMO,Thermo Fisher Scientific Inc Common Stock,United States,Industrials,Industrial Machinery/Components,385150857.0
TMST,TimkenSteel Corporation Common Shares,United States,Industrials,Steel/Iron Ore,38471893.0
TNC,Tennant Company Common Stock,United States,Industrials,Industrial Machinery/Components,17097317.0
TNET,TriNet Group Inc. Common Stock,United States,Consumer Discretionary,Business Services,36589391.0
TNK,Teekay Tankers Ltd.,Bermuda,Consumer Discretionary,Marine Transportation,23718060.0
TNL,Travel   Leisure Co. Common  Stock,United States,Consumer Discretionary,Hotels/Resorts,68439544.0
TNP,Tsakos Energy Navigation Ltd Common Shares,Greece,Consumer Discretionary,Marine Transportation,19329711.0
TOL,Toll Brothers Inc. Common Stock,United States,Consumer Discretionary,Homebuilding,108180788.0
TOST,Toast Inc. Class A Common Stock,United States,Technology,EDP Services,362666348.0
TPB,Turning Point Brands Inc. Common Stock,United States,Consumer Discretionary,Tobacco,15693673.0
TPC,Tutor Perini Corporation Common Stock,United States,Consumer Discretionary,General Bldg Contractors - Nonresidential Bldgs,42001112.0
TPH,Tri Pointe Homes Inc. Common Stock,United States,Consumer Discretionary,Homebuilding,97029418.0
TPL,Texas Pacific Land Corporation Common Stock,United States,Energy,Oil & Gas Production,6266124.0
TPR,Tapestry Inc. Common Stock,United States,Consumer Discretionary,Apparel,226474883.0
TPVG,TriplePoint Venture Growth BDC Corp. Common Stock,United States,Consumer Discretionary,Other Consumer Services,
TPX,Tempur Sealy International Inc. Common Stock,United States,Consumer Discretionary,Home Furnishings,125865630.0
TPZ,Tortoise Power and Energy Infrastructure Fund Inc Common Stock,United States,Finance,Investment Managers,
TR,Tootsie Roll Industries Inc. Common Stock,United States,Consumer Staples,Specialty Foods,13484094.0
TRC,Tejon Ranch Co Common Stock,United States,Finance,Real Estate,20838624.0
TREX,Trex Company Inc. Common Stock,United States,Basic Materials,Forest Products,108002858.0
TRGP,Targa Resources Inc. Common Stock,United States,Utilities,Natural Gas Distribution,220034454.0
TRN,Trinity Industries Inc. Common Stock,United States,Industrials,Railroads,80903231.0
TRNO,Terreno Realty Corporation Common Stock,United States,Real Estate,Real Estate Investment Trusts,81074577.0
TROX,Tronox Holdings plc Ordinary Shares (UK),United States,Industrials,Major Chemicals,116635262.0
TRTN,Triton International Limited Common Shares,United States,Consumer Discretionary,Diversified Commercial Services,53891110.0
TRTX,TPG RE Finance Trust Inc. Common Stock,United States,Real Estate,Real Estate Investment Trusts,61107894.0
TRU,TransUnion Common Stock,United States,Finance,Finance: Consumer Services,192592522.0
TRV,The Travelers Companies Inc. Common Stock,United States,Finance,Property-Casualty Insurers,227955587.0
